NAME,FOLLOWER,LIKE,DESCRIPTION,"TOTAL RETWEET",TOTAL_LIKE,TWEET
IvanRaupp,62947,1268,"Nascido em Resende-RJ, 28 anos, correspondente do @globoesportecom na Europa. Passagem pelas coberturas de Flamengo e MMA.",15958,18531,"@Duds_Junior Há um equívoco aí: não vi ninguém nu hahaha"
,,,,,,"Produção para o @jornalnacional com esse casal sensacional de Weggis. Brasil x Suíça na estreia da Copa - globoplay… https://t.co/XYAPZzXPJo"
,,,,,,"A capa de um dos principais jornais aqui da Suíça traz Neymar ao lado de @ValescaOficial e @AdrianaBombom para faze… https://t.co/7bGRiRf83U"
,,,,,,"Vaza foto de Arthur com camisa do Barça --- O que apuramos: o Barcelona tem interesse no jogador do Grêmio e promov… https://t.co/eIXSNVlyDT"
,,,,,,"”Estamos pedindo absolvição e alegando que ele não contribuiu de nenhuma forma para esse resultado positivo”, compl… https://t.co/yhRniTmRnU"
,,,,,,"Bichara Neto resumiu o julgamento: “A Fifa analisou o conjunto das provas e se convenceu de que o resultado positiv… https://t.co/jFhBWEEASE"
,,,,,,"Lembrando que a suspensão provisória do Guerrero termina na segunda-feira. Esticando mais alguns dias, Fifa terá ma… https://t.co/3GNe76scTM"
,,,,,,"Bichara Neto, advogado do Guerrero: “Semana que vem anunciam o resultado. Deverão estender a suspensão provisória d… https://t.co/oF4umz67s2"
,,,,,,"Defesa pede absolvição, e Fifa deve estender suspensão provisória de Guerrero https://t.co/Vri0LTut0v #gefla"
,,,,,,"@raifcastro Muito foda"
,,,,,,"@LucasmarquesMe5 @EuclidesFla acho, só acho, que um dia ele vai jogar no Flamengo"
,,,,,,"@edu_peixoto 😂"
,,,,,,"César merece todo o sucesso. É um cara 100% do bem, humilde e muito trabalhador. Esse brilho de hoje até demorou a… https://t.co/I23Yqt2zOw"
,,,,,,"@UrubuMatuto não sei ainda"
,,,,,,"@UrubuMatuto valeu, amigo! voltarei ao Rio já já, em janeiro mesmo!"
,,,,,,"@UrubuMatuto po mas ele tinha acabado de sair da sala quentinha, nem sentiu tanto. e quem ficou na neve durante horas direto?"
,,,,,,"@UrubuMatuto valeu, irmão! Frio? Nem sei mais como definir isso aqui hahaha tá brabo"
,,,,,,"Guerrero também disse que vai assistir ao jogo de logo mais entre Junior Barranquilla e Flamengo, pela Copa Sul-Ame… https://t.co/2474zHniNk"
,,,,,,"De acordo com Guerrero e seus advogados, o resultado do julgamento de hoje deverá ser conhecido no início da próxima semana #gefla"
,,,,,,"Guerrero estará na Copa? ""Estou resolvendo essa questão da minha carreira antes de pensar nisso. Quero resolver, po… https://t.co/xttfMaokVS"
,,,,,,"Guerrero: ""Graças a Deus provamos tudo. A Fifa descartou o uso de cocaína. Isso não conta mais. Agora só falta a decisão da Fifa"" #gefla"
,,,,,,"Guerrero: ""Estou tranquilo, porque sou inocente. Vim até a Suíça para demonstrar essa inocência. Graças a Deus cons… https://t.co/EPHqb7n0ec"
,,,,,,"Após 4 horas de julgamento, Guerrero deixa a Fifa confiante na absolvição: ''Provamos tudo''… https://t.co/GMejzEZKHd"
,,,,,,"Até crianças em frente à Fifa #gefla https://t.co/x9vzxXLBOx"
,,,,,,"Peruanos seguem encarando o frio. Estão à espera de Guerrero, que deve sair em breve #gefla https://t.co/QXtQLkK2yL"
,,,,,,"O resultado do julgamento deve sair até segunda-feira, dia em que termina a suspensão provisória de Guerrero #gefla"
,,,,,,"Vídeo com informações sobre o julgamento do Guerrero. E com a alegria dos esperançosos peruanos. Deem uma olhada -… https://t.co/edppSfQovv"
,,,,,,"Olha aí os peruamos apoiando o Guerrero na Fifa https://t.co/W4rHIfP7iE"
,,,,,,"Seguimos por aqui em Zurique. Mais tarde traremos notícias de como foi o julgamento #gefla"
,,,,,,"Vários peruanos que moram na Suíça encararam o frio abaixo de zero para dar apoio a Guerrero, maior estrela do fute… https://t.co/FGX2NUaTGH"
,,,,,,"Vale lembrar que, segundo os advogados de Guerrero, é improvável que o resultado do julgamento saia hoje. Deve sair… https://t.co/OKIJ8SZILW"
,,,,,,"Não consegui twittar antes, galera. Atualizando então: Guerrero está sendo julgado neste momento. A sessão é fechad… https://t.co/qjipSsekzJ"
,,,,,,"Com apoio de peruanos, Guerrero chega para seu julgamento na sede da Fifa https://t.co/1Yq7zHjWZt"
,,,,,,"Guerrero encara hoje julgamento por doping na Fifa; sentença pode sair até segunda-feira https://t.co/VuzkWNHx9G"
,,,,,,"@lucasfcocrf valeu, amigo!"
,,,,,,"@lucasfcocrf 11h de Brasília"
,,,,,,"@TozzaFla hahaha sabia"
,,,,,,"Guerrero Tá Ná Área https://t.co/zVYEbiEzmX"
,,,,,,"@TozzaFla Ou é fake? Hahaha"
,,,,,,"@TozzaFla Ué, voltou???"
,,,,,,"Lembrando que a pena máxima para casos como o de Guerrero é de 4 anos de suspensão. O que você acha que vai acontecer?"
,,,,,,"A matéria e o vídeo da chegada de Paolo Guerrero à Suíça https://t.co/Dj43UyXh67"
,,,,,,"O julgamento de Guerrero deve durar cerca de 3 horas, e o resultado não deve sair amanhã. Expectativa dos advogados… https://t.co/htciO1iBGe"
,,,,,,"Guerrero será julgado na sede da Fifa nesta quinta-feira, em sessão prevista para começar às 11h (de Brasília). Ele… https://t.co/JnHXGrhkoh"
,,,,,,"Apesar da viagem cansativa, Guerrero chegou sorridente: ""Com certeza (estou confiante na absolvição). Estou bem tra… https://t.co/W9ahDr6mf8"
,,,,,,"Guerrero desembarcou há pouco em Zurique ao lado dos advogados Bichara Neto e Pedro Fida e do bioquímico Luiz Carlos Cameron #gefla"
,,,,,,"Chegamos a Zurique, Suíça, para acompanhar o julgamento do Guerrero na Fifa - será amanhã. O atacante peruano do Fl… https://t.co/DSw0yfN6XV"
,,,,,,"Falta MUITO para chegar ao nível do MSN, mas é fato que o trio MCN começou voando no PSG https://t.co/Jhi6PCVZ9Y"
,,,,,,"Com salto de Neymar, trio MCN do PSG supera início do MSN no Barça https://t.co/Q88XywhjQo"
,,,,,,"@guimisantos o lance é que o Girona pertence ao Manchester City, né? foi comprado pelo ingleses. por isso esse caso é um pouco diferente"
,,,,,,"Mais sobre Douglas: se ele continuar com pouco espaço no Girona, é provável que seja reemprestado na Europa na próx… https://t.co/vafYCQq0VA"
,,,,,,"Sem espaço, Douglas (ex-Vasco) pode ter passagem pelo Girona abreviada https://t.co/w0PFkxVWPZ"
,,,,,,"@f_delaurentiis Ele e o irmão"
,,,,,,"@danidiascardoso @Baaabeel boaaaa, Maicon!"
,,,,,,"Amor pelo @Corinthians: Marquinhos diz que quer voltar ao time de coração no futuro https://t.co/beDLEF8Dln @marquinhos_m5 @MeuTimao"
,,,,,,"Os melhores ataques da primeira fase da Champions:

1- PSG (2017/18) - 24 gols (ainda falta um jogo)
2- Borussia Do… https://t.co/1a8beUomif"
,,,,,,"Superataque do PSG pulveriza recorde de gols na primeira fase da Champions; veja números https://t.co/F9umHH8zMd"
,,,,,,"Neymar se irrita com pergunta sobre o Real Madrid e abandona zona mista: ""Chatos demais"" https://t.co/zbwdgZfgsf https://t.co/cDpRz4DU8D"
,,,,,,"Depois do espetáculo, jogadores do PSG agradecem à torcida #trparis https://t.co/1p6r5zakEy"
,,,,,,"O PSG quebra e logo amplia o recorde de gols de um time na fase de grupos da Champions (24!!!!). E ainda falta uma… https://t.co/LWlEsVz712"
,,,,,,"Tem torcedor do Grêmio no Parc des Princes. Mais tarde tem final da Libertadores #trparis https://t.co/Iw99w7s3Sv"
,,,,,,"Hoje tá como o Neymar gosta: pura ousadia e alegria. Jogando fácil o camisa 10 #trparis"
,,,,,,"Tá fácil o jogo para o PSG. Se mantiver o ritmo, podemos ter goleada histórica hoje #trparis"
,,,,,,"Olha o PSG se impondo. Comemoração calorosa entre Cavani e Neymar após gol do uruguaio, depois com todos os jogador… https://t.co/8Xig8rFXyO"
,,,,,,"“Aquarela do Brasil” para Neymar. Baita atuação do craque até aqui, virando o jogo com dois gols. Escuta aí https://t.co/3Mb2VBXlol"
,,,,,,"Gol da fera!!! PSG reagiu rápido #trparis https://t.co/OCDmktMJw3"
,,,,,,"Depois de quatro jogos inteiros, PSG é vazado pela primeira vez nesta Champions. Era a única defesa que ainda não t… https://t.co/oT2VuLSAlb"
,,,,,,"O famoso hino da Champions. Sempre de arrepiar https://t.co/X2shMM9OmB"
,,,,,,"O PSG tem o melhor ataque (17 gols) e a melhor defesa (0 gol) da Champions. Vem nova goleada hoje? #trparis"
,,,,,,"Olha a fera aí, tá se preparando para botar lá na gaveta #trparis https://t.co/Ds3YbeuqZT"
,,,,,,"Bastante torcida do Celtic também. Um número maior que o normal para visitantes #trparis https://t.co/FlaU22VYQe"
,,,,,,"Torcida do PSG na área #trparis https://t.co/4M4HXB3zqF"
,,,,,,"Fala, galera! Estamos no Parc des Princes para PSG x Celtic. Times se aquecem neste momento #trparis https://t.co/Ur1vFJRJwR"
,,,,,,"@and_moura já digo que faltou certo ""Monstro"" na capa hahahaha"
,,,,,,"@and_moura Aeee irmão chegou seu livro pra mim lá no Rio. Fim de dezembro volto, aí poderei ler. Abração e parabéns pela conquista!"
,,,,,,"Obrigado pela entrevista, @marquinhos_m5. Joga muito! https://t.co/4MvJJ2Dz6l"
,,,,,,"Entrevista exclusiva ----- @marquinhos_m5 vê PSG ""cicatrizado"" após 6 a 1 e garante: ""Nosso ambiente é muito bom"" https://t.co/HsWOLDma94"
,,,,,,"Técnico do Celtic vê PSG favorito ao título: “É o melhor entre os melhores” https://t.co/KYYAsYhyIw"
,,,,,,"""Boleiragem"" entre parças Neymar e Dani Alves marca treino descontraído do PSG https://t.co/1xoXJq5YvF"
,,,,,,"Noitadas? Unai Emery aprova vida social de Neymar: ""É jovem e deve aproveitar com os amigos"" https://t.co/3wlsptfp2v"
,,,,,,"@AllysonKennedy0 foi o que você leu na entrevista que o Rafinha deu para nós haha - https://t.co/VOKKm6NyLM Veja aí."
,,,,,,"Aos que perguntam: Rafinha participou de 15 das 19 partidas do Bayern nesta temporada e foi titular em 10. Está ati… https://t.co/cureVE6M5r"
,,,,,,"Olha aí a chamada oportunidade de mercado... Apuramos o seguinte:

Mais um na disputa: Flamengo faz contato pelo la… https://t.co/fN1jAeCyLf"
,,,,,,"Crianças ""tomam controle"" do Barça e ganham carinho de Messi em ação social https://t.co/35hrsxDnk8"
,,,,,,"Ex-Vasco, Douglas encontra dificuldades no Girona: ""Jogador não pode ficar feliz no banco"" https://t.co/tcPOIx2O0X https://t.co/dlwRZZuDJp"
,,,,,,"@sccpchjr Por que achou isso? A matéria teve base nas entrevistas que fiz com jornalistas italianos"
,,,,,,"Matéria com o @dg_douglas08, ex-Vasco, no Globo Esporte de hoje. Contratado pelo Manchester City, ele tá emprestado… https://t.co/iJnyWKFItD"
,,,,,,"Procurado para renovar com o Bayern, lateral Rafinha admite intenção de voltar ao futebol brasileiro; São Paulo e C… https://t.co/eRkfStwsUC"
,,,,,,"Possível volta de Ibra movimenta a Suécia, mas seleção foi mais eficiente sem ele; veja histórico… https://t.co/SBn1rCSJb2"
,,,,,,"Crise técnica, treinador incompatível... As razões que levaram a Itália ao fracasso https://t.co/YiUMZxKoQV https://t.co/x9UgKT8ISG"
,,,,,,"Após fracasso da Itália, Giampiero Ventura não entrega o cargo e dispara: ""A culpa é do técnico, já sabemos"" https://t.co/ZzL3S2oXjg"
,,,,,,"Técnico da Suécia se irrita com pergunta sobre Ibra: ""Ainda estamos falando dele"" https://t.co/XePonnpTe7"
,,,,,,"A festa dos suecos com a torcida que compareceu https://t.co/0Vzd3z0L7I"
,,,,,,"Volta, Ibra! Nunca te pedi nada 😂 #trmilao"
,,,,,,"Enquanto isso, suecos comemoram. E muito! #trmilao https://t.co/GYZjdtqPYL"
,,,,,,"Torcida italiana xinga o técnico Ventura. Alguns objetos são arremessados da arquibancada #trmilao https://t.co/eZNZLhgUrI"
,,,,,,"Italianos desolados, chorando #trmilao https://t.co/5LLyXrl3Ty"
,,,,,,"Acredite se quiser. A tetracampeã Itália está fora da Copa do Mundo. A última vez que isso tinha acontecido foi há… https://t.co/u7ZBmpZilv"
,,,,,,"Torcida italiana grita e tenta incentivar a Azzurra nos minutos finais. O clima é muito tenso por aqui #trmilao"
,,,,,,"Que noite terrível estão vivendo Barzagli e Candreva. Immobile é outro... Está nulo #trmilao"
,,,,,,"Quase 25 minutos do segundo tempo, e a Itália vive um DRAMA. Será que vai dar zebra mesmo? #trmilao"
,,,,,,"Alô Ventura, já passou da hora de colocar o Insigne, né? É o jogador mais perigoso do elenco italiano #trmilao"
,,,,,,"O ataque da Itália deixa a desejar. E o meio-campo não tem criatividade. Grande parte dos passes longos sai de Bonu… https://t.co/gzDTL3k4ku"
,,,,,,"Jorginho melhorou após um início ruim. Alternou bons passes com erros bobos. E orientou muitos companheiros taticamente #trmilao"
,,,,,,"A Itália está se doando em campo hoje, isso não dá para negar, mas o time é fraco no geral #trmilao"
,,,,,,"Joga bem o tal do Forsberg, camisa 10 dessa seleção sueca e que atua no RB Leipzig, da Alemanha. Ele é quem mais in… https://t.co/qzFhqmooxx"
,,,,,,"Que lambança do Barzagli! Errou passe infantil e na sequência cometeu pênalti. Sorte dele que o juiz não marcou #trmilao"
,,,,,,"@hmelooliveira @centraldanacao Suspenso"
,,,,,,"Os primeiros 15 minutos oficiais de Jorginho pela Itália foram ruins. O brasileiro parece estar nervoso #trmilao"
,,,,,,"Me pareceu pênalti em Parolo. Acho que errou o árbitro #trmilao"
,,,,,,"Torcida e imprensa italianas estão muito tensas. Mal começou o jogo, e muitos já xingam como loucos #trmilao"
,,,,,,"Belo mosaico, e torcida canta junto o hino https://t.co/Czt2Aer08Z"
,,,,,,"Times em campo #trmilao https://t.co/6UdmDcvMRC"
,,,,,,"Nome do contestado técnico Giampiero Ventura é bastante vaiado pela torcida. Jogadores foram aplaudidos #trmilao"
,,,,,,"O forte trio BBC vai proteger Buffon como sempre, mas hoje a Itália precisa de gols #trmilao https://t.co/ojMaAznPEQ"
,,,,,,"Italianos vaiam muito a escalação da Suécia. Começou a pressão! #trmilao"
,,,,,,"O clima é de muita tensão em toda a Itália. Mas o pessoal não deixa de acreditar #trmilao"
,,,,,,"Times deixam o campo. Daqui a pouco estarão de volta para o jogão #trmilao https://t.co/62qMX3rAYt"
,,,,,,"E você? Quer ver a Itália na Copa da Rússia? #trmilao"
,,,,,,"E aquela área lá em cima abriga os torcedores suecos #trmilao https://t.co/VsGteQGbmv"
,,,,,,"Torcida italiana vai enchendo aos poucos o San Siro #trmilao https://t.co/YazOGoP3sJ"
,,,,,,"Lembrando que a Itália perdeu em Estocolmo por 1 a 0 e precisa vencer hoje por dois gols de diferença - a regra dos… https://t.co/ZRY5KaJ8xj"
,,,,,,"A Itália só ficou fora da Copa duas vezes: em 1930 e 1958. A terceira será decretada hoje? #trmilao"
,,,,,,"Antes do jogo, o pessoal aproveita para fazer um lanche #trmilao https://t.co/YO7asyO5qx"
,,,,,,"As escalações e os bancos de reservas #trmilao https://t.co/m7rvMU6rab"
,,,,,,"As duas seleções estão no aquecimento #trmilao https://t.co/yRr5eWWxSZ"
,,,,,,"Mas hoje não tem time. Estão todos unidos pela Azzurra, que vive um drama para ir à Copa #trmilao https://t.co/egmKCwnF8V"
,,,,,,"Camisas do Milan também à venda. Lembrando que os dois rivais dividem o estádio San Siro #trmilao https://t.co/uimSdURMdQ"
,,,,,,"Do lado de fora, camisas da Inter de Milão à venda, com nomes do presente e do passado #trmilao https://t.co/LebLPLtPN5"
,,,,,,"Olha aí como tá grande a movimentação no San Siro https://t.co/ieig5WOLUC"
,,,,,,"Dupla sueca aposta em 1 a 1 hoje e vaga confirmada na Copa da Rússia #trmilao https://t.co/skUqLJ4E7X"
,,,,,,"Italianos devidamente caracterizados para torcer #trmilao https://t.co/2Ioz0lfyhu"
,,,,,,"O brasileiro Jorginho, destaque do Napoli, está confirmado na vaga do suspenso Verratti. Como será o primeiro jogo… https://t.co/GhokdiY2kI"
,,,,,,"Muitas crianças por aqui. Muitas mesmo. Todas empolgadas e prontas para empurrar a Itália #trmilao https://t.co/CWfzkLuIs9"
,,,,,,"Tá difícil para a Itália? Esse trio vai contra o pessimismo: “Fácil! Vamos ganhar de 3 a 0” #trmilao https://t.co/1fd1I8Onow"
,,,,,,"Equipes definidas #trmilao https://t.co/RGaJQKfG09"
,,,,,,"São esperadas mais de 70 mil pessoas. E a galera está comparecendo #trmilao https://t.co/1zfmToGm07"
,,,,,,"Falamos direto do San Siro. Daqui a pouco tem Itália x Suécia pela repescagem das eliminatórias europeias. É vida o… https://t.co/sOvdhmVYx8"
,,,,,,"+ Paulinho relembrou o convite de Messi para jogar no Barça, disse que gostaria de voltar ao Corinthians um dia e q… https://t.co/JKmyRS2KEn"
,,,,,,"Exclusiva! Paulinho cala questionamentos e conta que Neymar o influenciou na ida ao Barça https://t.co/0cTD4hvG7S… https://t.co/Bs4aRkOpcj"
,,,,,,"Eu e o @alexmaroliveira trocamos uma ideia aqui em Milão sobre esse clima tenso para Itália x Suécia. É hoje! https://t.co/46O8jT698y"
,,,,,,"Sob pressão, Itália joga a vida contra a Suécia para evitar ""tragédia nacional"" https://t.co/iBzU5nfKT9"
,,,,,,"Mesmo em vantagem, Suécia joga pressão para a Itália: ""Temos nada a perder"" https://t.co/p1Z1uLJo2w"
,,,,,,"Com a corda no pescoço, Itália faz último treino antes de decidir a vida contra a Suécia https://t.co/AaaxDPoH6H"
,,,,,,"Amanhã, às 17h45, Itália x Suécia aqui em Milão. É vida ou morte para a Azzurra na repescagem. O que vocês acham que vai acontecer?"
,,,,,,"Buffon admite tensão na Itália e dispara: ""Não podemos nos acostumar com a mediocridade"" https://t.co/72DgJTwM0t"
,,,,,,"Lucas é ""esquecido"" no PSG, e possibilidade de saída ganha força nos bastidores https://t.co/wLu1L4fGRi"
,,,,,,"Com moral, @Gremio é alvo de perguntas de Messi e Suárez no Barça, revela @paulinhop8 https://t.co/TahJQrRDmt"
,,,,,,"GSP is back! Hahahaha que monstro 👏👏👏 @GeorgesStPierre"
,,,,,,"Lembra dele? Ídolo português, ex-atacante Nuno Gomes explica por que recusou o Santos no passado https://t.co/dvpcTVyFT5"
,,,,,,"MS... e adeus N: restaurante de Messi retira camisa autografada de Neymar da parede https://t.co/j5MV2LEejO https://t.co/fmE9zxKGp4"
,,,,,,"Thiago Maia, Thiago Mendes, Luiz Araújo... O Lille agora tem conta em português. Legal essa aproximação https://t.co/SLqyJhtyeU"
,,,,,,"@ArthurQuezada Werner no banco?"
,,,,,,"Autor de hat-trick do PSG alcança feito histórico; saiba por que Kurzawa pediu silêncio https://t.co/5HlNLYayM7"
,,,,,,"Jogador do Anderlecht que trocou camisa com Neymar está feliz da vida #liganoge https://t.co/20nTOduTDX"
,,,,,,"PSG na Champions: 4 jogos, 4 vitórias, 17 gols a favor e nenhum contra. Espetacular início de temporada #liganoge"
,,,,,,"Hat-trick do Kurzawa! Sério, você está lendo isso mesmo #nuncaimaginei #liganoge"
,,,,,,"Neymar homenageou o amigo Lewis Hamilton após marcar - inglês foi tetra na F-1. Imagem do @colinvieira #liganoge https://t.co/gpYStSOjYG"
,,,,,,"Neymar homenageou o amigo Lewis Hamilton após marcar. Ainda fez o 4 com a mão pelo tetra do inglês na F-1 #liganoge https://t.co/EjZrvcbaPg"
,,,,,,"Todos os jogadores de linha do PSG na comemoração do gol de Neymar #liganoge https://t.co/MG8bsca4qt"
,,,,,,"Neymar está mancando há algum tempo. Parece estar com dores na coxa esquerda #liganoge"
,,,,,,"Olha aí a empolgação dos donos da casa https://t.co/K62xEAKHd9"
,,,,,,"Melhores ataques da Europa

1-PSG: 48 gols/15J (média 3,2) 
2-Manchester City: 45 gols/15J (3) 
3-Lazio: 42 gols/15J (2,8)

#liganoge"
,,,,,,"Pequena torcida do Anderlecht provoca a do PSG #liganoge https://t.co/efM8iyV6RB"
,,,,,,"Fato curioso: bar em frente ao estádio tem quadros de quatro times brasileiros: Flu, Fla, Grêmio e Vasco. A dona ac… https://t.co/RyxZxy5ti0"
,,,,,,"Boa parte da imprensa francesa apostou em Di María titular, mas errou. Mbappé tem crédito com Unai Emery #liganoge"
,,,,,,"Esse é ídolo por aqui #liganoge https://t.co/G4V4CEzpPE"
,,,,,,"Hoje é dia de novo massacre do PSG? #liganoge"
,,,,,,"Só pedrada no treino de chutes a gol #liganoge https://t.co/ntm20kIkxZ"
,,,,,,"Torcedores mirins são fãs principalmente dessa dupla aí #liganoge https://t.co/DFBbj7ELty"
,,,,,,"Torcida chega para a partida #liganoge https://t.co/XC4Vzktv8g"
,,,,,,"Fala, galera! Estamos no Parc des Princes para PSG x Anderlecht. Times no aquecimento #liganoge https://t.co/DbbYCTqali"
,,,,,,"Hoje tem! Neymar, Cavani... A bola rola às 17h45, e nossa transmissão começa às 16h45. Tudo ao vivo no… https://t.co/fwqSWzE93U"
,,,,,,"1-PSG: 48 gols/15J (média 3,2) 
2-City: 45 gols/15J (3) 
3-Lazio: 42 gols/15J (2,8) 
4-Porto: 40 gols/15J (2,7) 
5-… https://t.co/iiX2SsjbpE"
,,,,,,"Dono do melhor ataque da Europa, PSG vai em busca de novo atropelo na Champions https://t.co/4tuFuyFadQ"
,,,,,,"Técnico do Anderlecht foca no Campeonato Belga, mas quer evitar novo massacre do PSG https://t.co/7yYQhY3UJo"
,,,,,,"“Neymar senta na primeira fila”, garante Unai Emery, sobre sessões de vídeo do PSG https://t.co/8JyGVEhJFm"
,,,,,,"Frio? Daniel Alves surge careca em treino do PSG e ganha beijo de Neymar https://t.co/oWPAVEfGLL https://t.co/rEVDURqz0K"
,,,,,,"A situação na Catalunha é muito delicada. Hoje teve reportagem no @jornalhoje - https://t.co/064x4IFCOT https://t.co/o2gFjDbNsz"
,,,,,,"@vinnybrandt Hhahahha valeu irmão. Mas graças a Deus não vi essa cena"
,,,,,,"@guicruzzz @MarceloRussio @pedroivoalmeida hahahaha bom demais"
,,,,,,"@saultrujilloCRF verdade"
,,,,,,"Lembra dele? David Seaman recorda erro em gol de Ronaldinho em 2002 e diz: ""É parte de mim"" https://t.co/TgI3w45VQb"
,,,,,,"Em alta na Espanha, Léo Baptistão aprova renunciar à cidadania italiana para defender a Roja https://t.co/PB8x1DjhJd"
,,,,,,"Me perguntam sobre Lincoln (Flamengo) e Barcelona. Nunca teve nada, conforme apuramos, pelo menos até este momento."
,,,,,,"RT @futgloboradiosp: O comentarista @mariomarra fala com @IvanRaupp sobre o aniversário do time mais antigo do mundo

 🎧 Ouça aqui 📻 https:…"
,,,,,,"Parabéns ao @Sheffieldfc, o clube de futebol mais antigo do mundo e que hoje completa 160 anos. Tive o prazer de ir lá, muito legal mesmo"
,,,,,,"A temporada promete! ----- Pronto para o bote, Neymar vira ameaça real à supremacia de CR7 e Messi https://t.co/TfWQWZ90ak"
,,,,,,"RT @2010MisterChip: Han ganado los últimos 10 premios FIFA al mejor del mundo. 5 para cada uno. Son una pareja legendaria. Y nosotros muy a…"
,,,,,,"O maior injustiçado por estar fora dos 11 da Fifa é o @Casemiro. Temporada espetacular, tanto pelo Real Madrid quanto pela Seleção"
,,,,,,"Falamos com o ""garoto"". Que empolgação! --- CR7 brinca sobre reinado ao lado de Messi: ""Terminou? Está só começando"" https://t.co/KomiaiA7ZQ"
,,,,,,"Neymar considera justo o prêmio de CR7 e diz que Champions é decisiva: ""Pesa muito"" https://t.co/7X6S117Unt"
,,,,,,"É gênio, mas desculpa aí, Iniesta na seleção da Fifa da última temporada é inexplicável #fifa"
,,,,,,"A cara do Maradona durante a homenagem ao Pelé... #fifa"
,,,,,,"Corrigindo: Zidane foi eleito pela 1ª vez o melhor técnico do mundo em seu 2° ano na função. Fora os 3 prêmios como jogador. MITO #fifa"
,,,,,,"Neymar é o último jogador a chegar. Terno no estilo #fifa https://t.co/ixCKJpWfKZ"
,,,,,,"O favorito está na área: CR7 #fifa https://t.co/md4Fr6itBu"
,,,,,,"Motorista barbeiro! Esqueceu de frear o carro automático e deu uma batidinha no da frente. Sem jogador envolvido. F… https://t.co/nUY2QBcMGK"
,,,,,,"Messi acaba de chegar acompanhado da esposa. Foi ovacionado pelo público #fifa"
,,,,,,"A seleção da Fifa 2016/17: Buffon, Dani Alves, Ramos, Bonucci e Marcelo; Kroos, Modric e Iniesta; Messi, Cristiano e Neymar. Gostaram? #fifa"
