NAME,FOLLOWER,LIKE,DESCRIPTION,"TOTAL RETWEET",TOTAL_LIKE,TWEET
,,,,,,"Another record broken: 16 months in a row of undeniable, record-breaking heat.
https://t.co/qMAH7nFf5I #ActOnClimate"
,,,,,,"Happy #FirstDayofFall. https://t.co/ix02MNuOud"
,,,,,,"We can't sit idly by. Climate change is likely to threaten our national security—we must act now.… https://t.co/6QQmpf27W0"
,,,,,,"Judge Garland is highly qualified for the bench—even some Senate leaders who are now blocking his hearing have agre… https://t.co/D5ScOCikVl"
,,,,,,"Senate leaders' blind obstruction of Judge Garland's nomination sets a dangerous precedent. We can't stand idly by. https://t.co/k76I6DCDRI"
,,,,,,"Enough of the shameless partisanship, Senators. #DoYourJob and fill the Supreme Court vacancy. https://t.co/vIQY0bivo4"
,,,,,,"Help keep the pressure on Senate leaders to give Judge Garland a fair hearing before their next recess. https://t.co/lkLz4yidaw #DoYourJob"
,,,,,,"The American Bar Association gave Judge Garland its highest possible rating. He deserves a hearing and a vote.… https://t.co/FUVmGKdZgB"
